{"drill": "01hzydrill0000000000000002", "source": {"kind": "url", "url": "https://backups.r2.example.com/volumes/shop-data/20261006T120000Z.tar.zst.fkb?X-Amz-Signature=abc"}, "sha256": "9f86d081884c7d659a2feaa0c55ad015a3bf4f1b2b0b822cd15d6c15b0f00a08", "plaintext_sha256": "60303ae22b998861bce3b28f33eec1be758a213c86c93c076dbe9f558c11c752", "archive_bytes": 4194304, "uncompressed_bytes": 52428800, "encryption": {"mode": "cp", "key_id": "01hzybackup000000000000002", "key": "q6urq6urq6urq6urq6urq6urq6urq6urq6urq6urq6s="}, "checks": {"files": 1200, "tolerance_percent": 10}}
